[
  {
    "id": "aedg-roundabouts-opc",
    "title": "AEDG roundabouts — Tetra Tech OPC estimates (extracted)",
    "scope": "extracted",
    "collection": "aedg",
    "status": "reviewed",
    "producer_kind": "extracted",
    "command": "extract aedg/PRR-01-bundle.ocr.pdf --kind opc",
    "connector_ref": "bosc.pipeline.extract",
    "source": "Tetra Tech OPC estimates, PRR-01 bundle (0-based PDF pages 317 summary, 318-327 detail)",
    "external_url": null,
    "license": "Public record (Allen County public-records request PRR-01)",
    "access_tier": "public",
    "site_scope": "lima-legacy",
    "cadence": "static",
    "ttl_days": null,
    "last_refreshed": null,
    "tags": [
      "opc",
      "aedg",
      "roundabouts",
      "tetra-tech"
    ],
    "storage": [
      {
        "relpath": "extracted/aedg/roundabouts.summary.opc.yaml",
        "media_type": "application/x-yaml",
        "lfs": false
      },
      {
        "relpath": "extracted/aedg/roundabouts.detail.opc.yaml",
        "media_type": "application/x-yaml",
        "lfs": false
      }
    ],
    "observed": {
      "exists": true,
      "sha256": "7f52e51708d8d8b89fb6fdc75c2d465e2f11cc9d0014031551c5c71bdb765391",
      "size_bytes": 20591,
      "lfs_materialized": true,
      "file_count": 2,
      "stale": false,
      "asof": null
    },
    "citation": {
      "source": "Tetra Tech OPC estimates, PRR-01 bundle (0-based PDF pages 317 summary, 318-327 detail)",
      "source_kind": "document",
      "page": null,
      "confidence": "medium",
      "note": "bosc extract aedg/PRR-01-bundle.ocr.pdf --kind opc",
      "verified": true
    }
  },
  {
    "id": "echo-maumee-npdes",
    "title": "Maumee-basin NPDES discharger inventory (EPA ECHO)",
    "scope": "reference",
    "collection": "echo",
    "status": "reviewed",
    "producer_kind": "connector",
    "command": "npdes --basin maumee",
    "connector_ref": "bosc.hydrology.connectors.echo",
    "source": "EPA ECHO — cwa_rest_services (CWA v2017-10-13)",
    "external_url": "https://echo.epa.gov/tools/web-services",
    "license": "U.S. Government work (public domain)",
    "access_tier": "throttled",
    "site_scope": "basin-shared",
    "cadence": "quarterly",
    "ttl_days": 180,
    "last_refreshed": null,
    "tags": [
      "npdes",
      "cwa",
      "maumee",
      "wastewater"
    ],
    "storage": [
      {
        "relpath": "reference/echo/maumee-wwtp.all-npdes.yaml",
        "media_type": "application/x-yaml",
        "lfs": false
      },
      {
        "relpath": "reference/echo/maumee-wwtp.potw.yaml",
        "media_type": "application/x-yaml",
        "lfs": false
      },
      {
        "relpath": "reference/echo/maumee-wwtp.huc-counts.yaml",
        "media_type": "application/x-yaml",
        "lfs": false
      }
    ],
    "observed": {
      "exists": true,
      "sha256": "402765f1c8cbb21643f5d9b44e05ebe79776dd66f4c1767a1b484dbc9a5c1a22",
      "size_bytes": 649905,
      "lfs_materialized": true,
      "file_count": 3,
      "stale": false,
      "asof": null
    },
    "citation": {
      "source": "EPA ECHO — cwa_rest_services (CWA v2017-10-13)",
      "source_kind": "connector",
      "page": null,
      "confidence": "medium",
      "note": "bosc npdes --basin maumee",
      "verified": true
    }
  },
  {
    "id": "eia-consumer-energy",
    "title": "Eia Consumer Energy",
    "scope": "reference",
    "collection": "eia",
    "status": "needs-review",
    "producer_kind": "connector",
    "command": "eia",
    "connector_ref": "bosc.economics.energy",
    "source": "(unknown — fill in)",
    "external_url": null,
    "license": null,
    "access_tier": "public",
    "site_scope": "slug-scoped",
    "cadence": "on-demand",
    "ttl_days": null,
    "last_refreshed": null,
    "tags": [],
    "storage": [
      {
        "relpath": "reference/eia/consumer-energy.yaml",
        "media_type": "application/x-yaml",
        "lfs": false
      },
      {
        "relpath": "reference/eia/{site}/consumer-energy.yaml",
        "media_type": "application/x-yaml",
        "lfs": false
      }
    ],
    "observed": {
      "exists": true,
      "sha256": "8ea561986f05c55d7c35bf68b43ea3c794667464f8cbf193ad72cc27f9bc7666",
      "size_bytes": 23328,
      "lfs_materialized": true,
      "file_count": 19,
      "stale": false,
      "asof": null
    },
    "citation": {
      "source": "(unknown — fill in)",
      "source_kind": "connector",
      "page": null,
      "confidence": "medium",
      "note": "bosc eia",
      "verified": true
    }
  },
  {
    "id": "hydrology-ohio-principal-streams",
    "title": "Hydrology Ohio Principal Streams",
    "scope": "reference",
    "collection": "hydrology",
    "status": "needs-review",
    "producer_kind": "connector",
    "command": null,
    "connector_ref": "bosc.hydrology",
    "source": "(unknown — fill in)",
    "external_url": null,
    "license": null,
    "access_tier": "public",
    "site_scope": "basin-shared",
    "cadence": "on-demand",
    "ttl_days": null,
    "last_refreshed": null,
    "tags": [],
    "storage": [
      {
        "relpath": "reference/hydrology/ohio-principal-streams/principal-streams-and-drainage-areas.pdf",
        "media_type": "application/pdf",
        "lfs": true
      }
    ],
    "observed": {
      "exists": true,
      "sha256": "6cdbc7b5096a17dfd9d003c9e8f0baa77aabb5baafe048a9fb8713eeafb91a8e",
      "size_bytes": 7337655,
      "lfs_materialized": true,
      "file_count": 1,
      "stale": false,
      "asof": null
    },
    "citation": {
      "source": "(unknown — fill in)",
      "source_kind": "connector",
      "page": null,
      "confidence": "medium",
      "note": null,
      "verified": true
    }
  }
]
